nome,conta,cartao,mensagem
Ana Silva,12345-6,**** 1234,"Olá, Ana! Que seu planejamento financeiro deste mês te aproxime ainda mais dos seus objetivos. Conte conosco nessa jornada!"
Carlos Souza,98765-4,**** 5678,"Carlos, investir com constância faz toda a diferença. Continue construindo um futuro financeiro sólido!"
Mariana Lima,45678-1,**** 9876,"Mariana, pequenas decisões hoje podem gerar grandes conquistas amanhã. Continue cuidando do seu patrimônio!"
Pedro Santos,32145-9,**** 4567,"Pedro, organização financeira é liberdade. Continue acompanhando seus investimentos e evoluindo todos os dias!"
Juliana Alves,74125-8,**** 7412,"Juliana, cada passo rumo aos seus objetivos financeiros conta. Estamos aqui para ajudar nessa caminhada!"